sku,title,description,price,stock,image 1_link,image 2_link,image 3_link,image 4_link,image 5_link,brand,ean,delivery_time
Y0079-BOL2-K0085-20250613-16,Geschikt voor Starter in aluminium Startpedalen en onderdelen Zwart Makkelijk te trekken Met Niet Vervanging voor 47CC 49cc Verwijdering 2 Tijd Loop Pocket Bike Dirt Bike,"<div data-slate-node=""element""> <div data-slate-node=""element""> <div data-slate-node=""element""> <ul class=""a-unordered-list a-vertical a-spacing-mini""> <li class=""a-spacing-mini""> <div data-slate-node=""element""> <div data-slate-node=""element""><span data-slate-node=""text""><span data-slate-leaf=""true"" data-sent-id=""eJq21pAWwB"" class=""null hover-sent"">1: Dimensie: D&eacute;marreur &agrave; tractie, Diam&egrave;tre du trou: 80 mm, Diam&egrave;tre du trou: 120 mm Conditie: 100% Neuf.</span></span><span data-slate-node=""text""><span data-slate-leaf=""true"" data-sent-id=""BXd8Z4lA6B"" class=""null""> Jamais utilis&eacute;.</span></span><span data-slate-node=""text""><span data-slate-leaf=""true"" data-sent-id=""exqLQXaY8V"" class=""null""> Couleur toute neuve et de qualit&eacute; sup&eacute;rieure: sous forme d'images .100% HD real shot</span></span></div> <div data-slate-node=""element""><span data-slate-node=""text""><span data-slate-leaf=""true"" data-sent-id=""e3mMjAZ6Oz"" class=""null"">2: Mat&eacute;riel: Fait de double aluminium de haute qualit&eacute;, Plastique de haute qualit&eacute; cliquet de d&eacute;marreur, behoud de vorm en de kleur, r&eacute;siste &agrave; de corrosie en het duurzaam zijn</span></span></div> <div data-slate-node=""element""><span data-slate-node=""text""><span data-slate-leaf=""true"" data-sent-id=""VOX4YjyNOz"" class=""null"">3: Karakteristiek: gemakkelijk &agrave; installateur, combiner met een motormotor, een tondeuse &agrave; gazon, een g&eacute;n&eacute;rateur, etc.</span></span></div> <div data-slate-node=""element""><span data-slate-node=""text""><span data-slate-leaf=""true"" data-sent-id=""eq29ZXRWyV"" class=""null"">4: Lanceur pocket bike: Monter la plupart des v&eacute;los de poche 47cc 49cc.</span></span><span data-slate-node=""text""><span data-slate-leaf=""true"" data-sent-id=""BwbDPX9nRz"" class=""null""> Er kan een adapter worden gebruikt &agrave; de mini-moto quad, mini-crossmotor, mini-v&eacute;lo de course en een mini-Motard, ainsi que des v&eacute;los de poche</span></span></div> </div> </li> </ul> </div> </div> </div>",26.29 ,100,https://m.media-amazon.com/images/I/614wmIr2q3L.jpg,https://m.media-amazon.com/images/I/81BOS-T+dRL.jpg,https://m.media-amazon.com/images/I/61DY09R+5aL.jpg,https://m.media-amazon.com/images/I/61lfq8B6GyL.jpg,https://m.media-amazon.com/images/I/51TlQZ1lFNL.jpg,Merkloos,8410900586894,4-8d
Y0079-BOL2-K0085-20250613-17,Geschikt voor Cutper la cha?ne #428 520 525 528 530 cha?ne Vervanging voor gereedschap Moto Velo Velo VTT,<div data-slate-node="element"> <div data-slate-node="element"> <div data-slate-node="element"> <ul class="a-unordered-list a-vertical a-spacing-mini"> <li class="a-spacing-mini"> <div data-slate-node="element"><span data-slate-node="text">Diameter vingerhoed: 4 mm;</span><span data-slate-node="text">Effectieve lengte: 32 mm;</span><span data-slate-node="text">Lengte: 125 mm;</span><span data-slate-node="text" data-slate-fragment="==">Breedte: 100 mm</span></div> </li> </ul> </div> </div> </div>,18.35 ,100,https://m.media-amazon.com/images/I/614wmIr2q3L.jpg,https://m.media-amazon.com/images/I/81BOS-T+dRL.jpg,https://m.media-amazon.com/images/I/61DY09R+5aL.jpg,https://m.media-amazon.com/images/I/61lfq8B6GyL.jpg,https://m.media-amazon.com/images/I/51TlQZ1lFNL.jpg,Merkloos,8410900586900,4-8d
Y0079-BOL2-K0085-20250613-18,Geschikt voor 38 mm Rouge Filter ¨¤ air Vervanging voor Quad ATV Dirt Bike en Go Kart,<div data-slate-node="element"> <div data-slate-node="element"> <div data-slate-node="element"> <ul class="a-unordered-list a-vertical a-spacing-mini"> <li class="a-spacing-mini"> <div data-slate-node="element"><span data-slate-node="text">Totale lengte: 88 mm</span></div> <div data-slate-node="element"><span data-slate-node="text">Totale lengte: 88 mm</span></div> <div data-slate-node="element"><span data-slate-node="text">Binnendiameter: 38 mm</span></div> </li> <li class="a-spacing-mini"> <div data-slate-node="element"><span data-slate-node="text"></span><span data-slate-node="text">Het luchtfilter is geschikt voor VTT-crossmotoren en go-karten</span></div> </li> </ul> </div> </div> </div>,19.07 ,100,https://m.media-amazon.com/images/I/614wmIr2q3L.jpg,https://m.media-amazon.com/images/I/81BOS-T+dRL.jpg,https://m.media-amazon.com/images/I/61DY09R+5aL.jpg,https://m.media-amazon.com/images/I/61lfq8B6GyL.jpg,,Merkloos,8410900586917,4-8d
Y0079-BOL2-K0085-20250613-19,Geschikt voor Startpedalen en onderdelen Startersysteem Vervanging voor FS400 FS450 FS480 Trinkknop OEM 41280802101 FS 450 4128-080-2101 Motoren en onderdelen van Motor,"<div data-slate-node=""element""> <div data-slate-node=""element""> <div data-slate-node=""element""> <ul class=""a-unordered-list a-vertical a-spacing-mini""> <li class=""a-spacing-mini""><span class=""a-list-item"">1: Afmetingen: Totale lengte: 175 mm Gat voor bevestigingsschroef: 145 mm Vanwege de fout in de maatmeting kunt u de hoofdafbeelding van het product raadplegen voor gedetailleerde afmetingen.</span></li> <li class=""a-spacing-mini""><span class=""a-list-item"">1: Afmetingen: Totale lengte: 175 mm Gat voor bevestigingsschroef: 145 mm Vanwege de fout in de maatmeting kunt u de hoofdafbeelding van het product raadplegen voor gedetailleerde afmetingen. de hoofdproductafbeelding voor gedetailleerde afmetingen.</span></li> <li class=""a-spacing-mini""><span class=""a-list-item"">2: Geschikt voor model: Vervanging voor Stihl FS400 FS450 FS480 FS 400 FS 450 FS 480 kettingzaag</span></li> <li class=""a-spacing-mini""><span class=""a-list-item"">3: Geschikt voor OEM-nummers: 4128-080-2101</span></li> <li class=""a-spacing-mini""><span class=""a-list-item"">4: Hoge kwaliteit, echte schoten en 100% duurzaam, wat u het perfecte reparatie-alternatief biedt</span></li> </ul> </div> </div> </div>",23.24 ,100,https://m.media-amazon.com/images/I/614wmIr2q3L.jpg,https://m.media-amazon.com/images/I/81BOS-T+dRL.jpg,https://m.media-amazon.com/images/I/61DY09R+5aL.jpg,https://m.media-amazon.com/images/I/61lfq8B6GyL.jpg,https://m.media-amazon.com/images/I/51TlQZ1lFNL.jpg,Merkloos,8410900586924,4-8d
Y0079-BOL2-K0085-20250613-20,Geschikt voor Compatibel met vervanging voor KM90 KM100 KM110 KM130 FS90 FS100 FS110 FS130 FC90 FC100 FC110 FC130 Motor van grasmaaier Vervangen 4180 190 4000,"<div data-slate-node=""element""> <div data-slate-node=""element""> <div data-slate-node=""element""><span data-slate-node=""text"">1. Compatibel met de Stihl-modellen: KM90, KM100, KM110, KM130, FS90, FS100, FS110, FS130, FC90, FC100, FC110 en FC130</span></div> <div data-slate-node=""element""><span data-slate-node=""text"">1. Compatibel met de Stihl-modellen: KM90, KM100, KM110, KM130, FS90, FS100, FS110, FS130, FC90, FC100, FC110 en FC130</span></div> <div data-slate-node=""element""><span data-slate-node=""text"">2. Vervang de OEM-versterkingen: 4180 190 4000</span></div> <div data-slate-node=""element""><span data-slate-node=""text"">3. Doorsnede 3. Bevestiging: 7,5 mm;</span><span data-slate-node=""text""> Montagedoorsnede: 72 mm</span></div> </div> </div>",26.29 ,100,https://m.media-amazon.com/images/I/614wmIr2q3L.jpg,https://m.media-amazon.com/images/I/81BOS-T+dRL.jpg,https://m.media-amazon.com/images/I/61DY09R+5aL.jpg,https://m.media-amazon.com/images/I/61lfq8B6GyL.jpg,https://m.media-amazon.com/images/I/51TlQZ1lFNL.jpg,Merkloos,8410900586931,4-8d
Y0079-BOL2-K0085-20250613-21,Geschikt voor Tapis d'oreille de veiligheid,<div data-slate-node="element"> <div data-slate-node="element">Oordopjes met comfortabele oordopjes voor gebruik de hele dag<br />Goedgekeurd voor geluidsreductie en veiligheidsbewijs<br />Ideaal voor bouwplaatsen en andere lawaaierige omgevingen<br />NRR = 26 dB<br />Verstelbare hoofdband voor comfort</div> </div>,17.22 ,100,https://m.media-amazon.com/images/I/614wmIr2q3L.jpg,https://m.media-amazon.com/images/I/81BOS-T+dRL.jpg,https://m.media-amazon.com/images/I/61DY09R+5aL.jpg,https://m.media-amazon.com/images/I/61lfq8B6GyL.jpg,https://m.media-amazon.com/images/I/51TlQZ1lFNL.jpg,Merkloos,8410900586948,4-8d
Y0079-BOL2-K0085-20250613-22,Geschikt voor FC55 FS45 FS46 FS55 Rebound Starter Rebound Starter voor String Trimmer Weed Whacker,"<div data-slate-node=""element""> <div data-slate-node=""element"">Geschikt voor Stihl FS55 FC55 FS45 FS46<br />Pakket inclusief 1 terugslagstarter<br />Let op: Dit is een aftermarket onderdeel, geen origineel. Controleer de maatvoering op compatibiliteit voordat u bestelt.</div> </div>",26.34 ,100,https://m.media-amazon.com/images/I/614wmIr2q3L.jpg,https://m.media-amazon.com/images/I/81BOS-T+dRL.jpg,https://m.media-amazon.com/images/I/61DY09R+5aL.jpg,https://m.media-amazon.com/images/I/61lfq8B6GyL.jpg,https://m.media-amazon.com/images/I/51TlQZ1lFNL.jpg,Merkloos,8410900586955,4-8d
Y0079-BOL2-K0085-20250613-23,"Geschikt voor Compatibel met OEM4149 190 4001 rebound trekkingsstarter voor Fs94, Fs94r, Km94, Km94r, Hl91k, Hl94, Hl94k, FS94C, FS94RC","<div data-slate-node=""element""> <div data-slate-node=""element"">?? Ontworpen voor het model FS94 / Fs94R / KM94 / KM94R / HL91K / HL94 / HL94K / FS94C / FS94RC grasmaaier, perfect alternatief voor originele OEM4149 190 4001 onderdelen, los het probleem op van beginnende veroudering, breuk of onvoldoende spanning, versterk nieuwe apparatuur!<br />?? Eenvoudig te installeren: Dupliceer de originele afmetingen en bevestigingsgaten, met een duidelijk installatiediagram, geen gereedschap nodig, 5 minuten om de vervanging te voltooien, de beginner kan het gemakkelijk gebruiken, de prestaties van de upgrade-apparatuur zonder risico.<br />?? Het gebruik van hoogwaardig touw en slijtvaste veer, met een anti-verouderings kunststof behuizing, is bestand tegen complexe buitenomstandigheden (hoge temperatuur, vochtigheid, olie) zonder druk, de levensduur is veel langer dan die van gewone alternatieven.<br /> />?? Bespaar tijd en moeite. Dankzij het ingebouwde ontwerp met dubbele lagers wordt de trekweerstand met 30% verminderd en de rebound-reactiesnelheid met 50% verhoogd. Zeg vaarwel tegen de schaamte van ""trekken en stuiteren"". Ook oudere/vrouwelijke gebruikers kunnen het apparaat eenvoudig bedienen. De ontsteking met ¨¦¨¦n knop is moeiteloos.</div> </div>",29.53 ,100,https://m.media-amazon.com/images/I/614wmIr2q3L.jpg,https://m.media-amazon.com/images/I/81BOS-T+dRL.jpg,,,,Merkloos,8410900586962,4-8d
Y0079-BOL2-K0085-20250613-24,Geschikt voor Starter en vervangende klikket voor borstelooster 260U/265LRH/270MT/250C/260L - Tuinbouwgereedschap,"<div data-slate-node=""element""> <div data-slate-node=""element""><span data-slate-node=""text"">[Compatibel vervangingsonderdeel]: Deze starter- en palkit is speciaal ontworpen voor modellen zoals de 250C, 260L, 260U, 265LRH en 270MT, en biedt een perfecte pasvorm en betrouwbare prestaties voor uw trimmer of bosmaaier.</span><span data-slate-node=""text""> Zorg dat uw tuingereedschap weer werkt met dit zeer functionele vervangingsonderdeel.</span></div> <div data-slate-node=""element""><span data-slate-node=""text"">Stevige constructie: Gemaakt van robuust kunststof en metaal, is deze starter- en ratelcombinatie gebouwd om de uitdagingen van buitengebruik te weerstaan.</span><span data-slate-node=""text""> Het duurzame ontwerp minimaliseert de noodzaak voor frequente vervangingen, waardoor u op de lange termijn geld en frustratie bespaart.</span></div> <div data-slate-node=""element""><span data-slate-node=""text"">Snelle en eenvoudige installatie: dankzij het eenvoudige ontwerp is de installatie probleemloos, zonder dat er speciaal gereedschap of technische kennis nodig is.</span><span data-slate-node=""text""> U kunt snel versleten onderdelen vervangen en weer verdergaan met uw tuinwerkzaamheden zonder onnodige vertragingen of ingewikkelde procedures.</span></div> <div data-slate-node=""element""><span data-slate-node=""text"">Verbeterd startmechanisme: door uw versleten originele onderdelen te vervangen door deze hoogwaardige starter en pal, kunt u de effici?nte startcapaciteit van uw grasmaaier herstellen.</span><span data-slate-node=""text""> Ervaar soepeler trekken en betrouwbaardere starts met deze goed ontworpen vervangingsset.</span></div> </div>",17.84 ,100,https://m.media-amazon.com/images/I/614wmIr2q3L.jpg,https://m.media-amazon.com/images/I/81BOS-T+dRL.jpg,https://m.media-amazon.com/images/I/61DY09R+5aL.jpg,https://m.media-amazon.com/images/I/61lfq8B6GyL.jpg,https://m.media-amazon.com/images/I/51TlQZ1lFNL.jpg,Merkloos,8410900586979,4-8d
Y0079-BOL2-K0085-20250613-25,"Geschikt voor 579063101 Recoil Starter Assembly voor Trimmers 128C 128CD 128L 128LD 128LDX 128DJX 128R 128RJ Trekstart, vervangt 576368301","<div data-slate-node=""element"">Vervangt OEM-onderdelen: 579063101, 576368301<br />Past op modellen: 128C, 128CD, 128L, 128LD, 128LDX, 128R, 128RJ, 128DJX<br />128LD terugslagstarter gemaakt van hoogwaardig kunststof, duurzaam en stabiel, eenvoudig te installeren en te gebruiken<br />Pakketinhoud: 1 x terugslagstarter<br />Vervanging voor Husqvarna 128C 128CD 128L 128LD 128LDX 128DJX 128R 128RJ reserveonderdelen</div>",19.31 ,100,https://m.media-amazon.com/images/I/614wmIr2q3L.jpg,https://m.media-amazon.com/images/I/81BOS-T+dRL.jpg,https://m.media-amazon.com/images/I/61DY09R+5aL.jpg,https://m.media-amazon.com/images/I/61lfq8B6GyL.jpg,https://m.media-amazon.com/images/I/51TlQZ1lFNL.jpg,Merkloos,8410900586986,4-8d
Y0079-BOL2-K0085-20250613-26,Geschikt voor Starter met herinnering voor zaaien STIHL TS410 TS420 TS480I TS500I TS 410 420 480I 500I,"<div data-slate-node=""element""><span data-slate-node=""text"">R&eacute;f&eacute;rence fabricant de remplacement: 4238190 0300 4250190 0301, 4238190 0302, 4238190 0402B, 4238190 0404</span></div> <div data-slate-node=""element""><span data-slate-node=""text"">Vervanging voor STIHL TS410 TS410Z TS420 TS420Z TS480i TS510i les &agrave; b&eacute;ton </span></div> <div data-slate-node=""element""><span data-slate-node=""text"">Vervangingsproduct van hoge kwaliteit, correspondeer met originele stukken</span></div>",28.30 ,100,https://m.media-amazon.com/images/I/614wmIr2q3L.jpg,https://m.media-amazon.com/images/I/81BOS-T+dRL.jpg,https://m.media-amazon.com/images/I/61DY09R+5aL.jpg,https://m.media-amazon.com/images/I/61lfq8B6GyL.jpg,https://m.media-amazon.com/images/I/51TlQZ1lFNL.jpg,Merkloos,8410900586993,4-8d
Y0079-BOL2-K0085-20250613-27,"Geschikt voor Klein schaar voor snijdermachine, Verticale snijdermachine, Draagbare snijdermachineondersteuning, Schaar voor snijdermachine, Gids voor snijdermachine","<ul class=""a-unordered-list a-vertical a-spacing-mini""> <li class=""a-spacing-mini""> <div data-slate-node=""element""> <div data-slate-node=""element""> <ul class=""a-unordered-list a-vertical a-spacing-mini""> <li class=""a-spacing-mini""><span class=""a-list-item"">Veelzijdige compatibiliteit: deze houtzaaggeleider voor kettingzagen is geschikt voor diverse kettingzagen en biedt een veilige en stabiele bevestiging die veilig en betrouwbaar is en ongelukken of incidenten tijdens gebruik voorkomt.</span></li> <li class=""a-spacing-mini""><span class=""a-list-item"">¡¾Verstelbaar klembereik¡¿Dankzij de mogelijkheid om het klembereik aan te passen, kan deze zaaggeleider eenvoudig houten planken van 2 x 6 inch verwerken, wat de effici?ntie en nauwkeurigheid verhoogt. De meegeleverde kleine sleutel zorgt voor eenvoudige demontage en montage, waardoor hij handig in gebruik is.</span></li> <li class=""a-spacing-mini""><span class=""a-list-item"">¡¾Constructie: Deze zaaggeleider is gemaakt van hoogwaardig staal en is ontworpen om intensief gebruik en slijtage te weerstaan, voor een lange levensduur en duurzaamheid. Dit maakt het een betrouwbaar gereedschap voor veeleisende zaagwerkzaamheden.</span></li> <li class=""a-spacing-mini""><span class=""a-list-item"">Effici?nte zaagprestaties: Met deze kettingzaag met de geleiderplaat wordt het zagen van cederhout, walnoothout en eikenhout in dunne stukken moeiteloos. Het is een waardevolle assistent voor houthakkers en zorgt voor soepele en nauwkeurige zaagbewerkingen.</span></li> </ul> </div> </div> </li> </ul>",53.81 ,100,https://m.media-amazon.com/images/I/614wmIr2q3L.jpg,https://m.media-amazon.com/images/I/81BOS-T+dRL.jpg,https://m.media-amazon.com/images/I/61DY09R+5aL.jpg,https://m.media-amazon.com/images/I/61lfq8B6GyL.jpg,https://m.media-amazon.com/images/I/51TlQZ1lFNL.jpg,Merkloos,8410900587006,4-8d
Y0079-BOL2-K0085-20250613-28,Geschikt voor Vervangkop voor 10-tanden borstelooster compatibel met Oleo Mac Dia EM780 (28 x 10 tanden),<ul class="a-unordered-list a-vertical a-spacing-mini"> <li class="a-spacing-mini"> <div data-slate-node="element"> <div data-slate-node="element"><span data-slate-node="text">Compatibel met accessoires voor de Broussailleuse EM780</span></div> <div data-slate-node="element"><span data-slate-node="text">Inhoud van de emballage: 1 x 28 x 10 deuken of 1 x 32 x 10 deuken</span></div> <div data-slate-node="element"><span data-slate-node="text">Bekijk de aandacht op de afbeeldingen voor de compatibiliteit&eacute; avant votre achat</span></div> </div> </li> </ul>,48.55 ,100,https://m.media-amazon.com/images/I/614wmIr2q3L.jpg,https://m.media-amazon.com/images/I/81BOS-T+dRL.jpg,,,,Merkloos,8410900587013,4-8d
Y0079-BOL2-K0085-20250613-29,Geschikt voor Vervangende versnellingskop compatibel met de accessoires voor grasmaaier SILHL FS55 FS38 FS45 FS55RC,"<ul class=""a-unordered-list a-vertical a-spacing-mini""> <li class=""a-spacing-mini""> <div data-slate-node=""element""><span data-slate-node=""text""><span data-slate-leaf=""true"" data-sent-id=""zr0alPvR9e"" class=""null"">Compatibel met FS55 FS38 FS45 FS55RC</span></span></div> <div data-slate-node=""element""><span data-slate-node=""text""><span data-slate-leaf=""true"" data-sent-id=""BZ2OD5mlMB"" class=""null"">Inhoud van de verpakking: zoals op foto's</span></span></div> <div data-slate-node=""element""><span data-slate-node=""text""><span data-slate-leaf=""true"" data-sent-id=""zlQmwZPE5B"" class=""null"">Veuillez v&eacute;rifier aandacht voor afbeeldingen voor de compatibiliteit&eacute; avant votre achat</span></span></div> </li> <li class=""a-spacing-mini""> <div data-slate-node=""element""><span data-slate-node=""text""><span data-slate-leaf=""true"" data-sent-id=""zlQmwZPE5B"" class=""null""></span></span><span data-slate-node=""text""><span data-slate-leaf=""true"" data-sent-id=""BDGjbm95Ez"" class=""null"">Apr&egrave;s r&eacute;ceptie van de marchandise, als u vragen heeft, kunt u contact opnemen met &agrave; uitzendkrachten. </span></span></div> </li> </ul>",42.95 ,100,https://m.media-amazon.com/images/I/614wmIr2q3L.jpg,https://m.media-amazon.com/images/I/81BOS-T+dRL.jpg,,,,Merkloos,8410900587020,4-8d
Y0079-BOL2-K0085-20250613-30,"Geschikt voor Fruitverzamelkop, effectieve aluminiumlegering met afvalverzamelkop van 26 mm voor fruittuin","<ul class=""a-unordered-list a-vertical a-spacing-mini""> <li class=""a-spacing-mini""><span class=""a-list-item"">is gemaakt van hoogwaardig aluminiumlegeringmateriaal, dat slijtvast is en een lange levensduur heeft.</span></li> <li class=""a-spacing-mini""><span class=""a-list-item"">[Stabiele prestaties] Professionele productie, voortreffelijk vakmanschap, zorgen voor de beste stabiele prestaties.</span></li> <li class=""a-spacing-mini""><span class=""a-list-item"">[Effici?nte oogst] Het kan effici?nt en snel olijven oogsten van hoge plaatsen, het is het accessoire voor het verzamelen in de tuin.</span></li> <li class=""a-spacing-mini""><span class=""a-list-item"">[Eenvoudig te installeren] Dit product is eenvoudig te installeren, zeer handig in gebruik en een directe vervanging voor de oude of kapotte.</span></li> <li class=""a-spacing-mini""><span class=""a-list-item"">[Brede toepassing] Dit product wordt veel gebruikt in fruit- en tuinbouw en kan worden gebruikt voor de oogst van olijven, peren, sinaasappels en ander fruit.</span></li> </ul>",67.67 ,100,https://m.media-amazon.com/images/I/614wmIr2q3L.jpg,https://m.media-amazon.com/images/I/81BOS-T+dRL.jpg,https://m.media-amazon.com/images/I/61DY09R+5aL.jpg,https://m.media-amazon.com/images/I/61lfq8B6GyL.jpg,https://m.media-amazon.com/images/I/51TlQZ1lFNL.jpg,Merkloos,8410900587037,4-8d
