sku,title,description,price,stock,image 1_link,image 2_link,image 3_link,image 4_link,image 5_link,brand,ean,delivery_time
BOL2-MJ-K0297-250529-08,"30 cm Handdoekhouder met zuignap, intrekbare handdoekhouder met zuignap, draaibare hoekhanddoekhouder, schoenenrek, gatvrije badkameropberger, luxe, geschikt voor badkamer en keuken ","<p>1. Veelzijdig en ruimtebesparend: onze verstelbare handdoekhouder met zuignap is niet alleen een handdoekenrek, maar ook een schoenenrek en opbergruimte voor in de badkamer. Hij kan in verschillende hoeken worden gedraaid, waardoor hij ideaal is voor    kleine ruimtes of badkamers met beperkte opbergmogelijkheden.</p>
<p>2. Sterke zuigkracht en geen boren nodig: Dankzij de krachtige zuignappen kan deze handdoekhouder stevig aan elke muur worden bevestigd zonder te boren. Het biedt een betrouwbare en handige oplossing voor wie zijn muren of tegels niet wil beschadigen.</p>
<p>3. Uitschuifbaar ontwerp voor extra gemak: Dankzij het telescopische ontwerp van onze handdoekhouder kunt u de lengte aanpassen aan uw behoeften. Of u nu een paar handdoeken of een grote verzameling hebt, deze uitschuiffunctie zorgt ervoor dat u ze allemaal    gemakkelijk kunt plaatsen.</p>
<p>4. Premium kwaliteit en stijlvolle uitstraling: Gemaakt van hoogwaardige materialen, is onze handdoekhouder gebouwd om lang mee te gaan. Het strakke en moderne ontwerp voegt een vleugje luxe toe aan uw badkamerinrichting en cre?ert een visueel aantrekkelijke   en georganiseerde ruimte.</p>
<p>5. Eenvoudige installatie en verwijdering: Het installeren van deze handdoekhouder is een . Druk de zuignappen stevig op de gewenste plek en ze plakken direct. Wanneer het tijd is om de zuignap te verplaatsen of te verplaatsen, trek je gewoon aan het    lipje om de zuignap te ontgrendelen. Geen schade of beschadigingen. Geniet van probleemloze installatie en gebruik.</p>",18.45,100,https://s.alicdn.com/@sc04/kf/H8a727eebedfc46db8a76b0119c78227bZ.jpg_720x720q50.jpg,https://cbu01.alicdn.com/img/ibank/O1CN01r9fus11N2Xrbw5Q9m_!!2218695471512-0-cib.jpg,https://s.alicdn.com/@sc04/kf/H49d1beccb78c4012b5a3f68dcffab15b1.jpg_720x720q50.jpg,https://s.alicdn.com/@sc04/kf/H004f506d9c3f48f288ba3e77e0b2e4a3g.jpg_720x720q50.jpg,https://s.alicdn.com/@sc04/kf/H7f2152d267bf4ce89dd55681c9a044bf8.jpg_720x720q50.jpg,Merkloos,8410900586757,4-8d
