internereferentie,sku,title,description,price,stock,image 1_link,image 2_link,image 3_link,image 4_link,image 5_link,brand,ean,delivery_time
BOL2-MJ-K0297-250618-01,BOL2-MJ-K0297-250618-01,"Snelle eierkoker, elektrische eierkoker met automatische uitschakeling, gekookte eieren, pocheerder, omeletmaker, anti-droogbrand eierpocheerder (roze)","<p>¡¾Capaciteit voor zeven eieren¡¿ De elektrische eierkoker kan tot wel 7 eieren tegelijk koken, zowel zacht- als hardgekookt, en bespaart daarmee tijd en water. De snelle eierkoker is voorzien van een maatbeker om de hoeveelheid water te regelen. Voeg water
toe op basis van het waterniveau in de maatbeker om eieren tot verschillende gaarheidsniveaus te koken.</p>
<p>¡¾Automatische uitschakeling¡¿ Anti-droogbrand, automatische uitschakeling. Wanneer het water opraakt of de temperatuur van de verwarmingsplaat te hoog is, schakelt het lampje automatisch uit, veilig en betrouwbaar. De eierpocheerder is gemaakt van hoogwaardig
polypropyleen en roestvrij staal, wat veilig en duurzaam is. Eieren komen altijd perfect uit de eierkoker met een gemakkelijk te pellen schaal, en schoonmaken is een fluitje van een cent. ¡¾Lichtgewicht ontwerp¡¿ De eierkoker heeft een schattig kipvormig
ontwerp om een ??vleugje schattigheid en natuur aan je huis toe te voegen. Compact en lichtgewicht, past hij gemakkelijk in lades voor opslag of gewoon op het aanrecht als een leuk en kleurrijk accent in elke keuken.</p>
<p>¡¾Veelzijdig¡¿ De kippeneierkoker wordt gebruikt om eieren en diverse gerechten in bakjes te stomen. Hardgekookte eieren, zachtgekookte eieren, gepocheerde eieren, roerei, individuele omeletten, en dit alles in slechts een paar minuten na het indrukken
van de startknop. Het is een alles-in-¨¦¨¦n eierkoker, groentestomer, voedselstomer en meer!</p>",25.39 ,100 ,https://m.media-amazon.com/images/I/51CT+h-ya0L._AC_SL1500_.jpg,https://m.media-amazon.com/images/I/71mYLoPHxJL._AC_SL1500_.jpg,https://m.media-amazon.com/images/I/71UAukpbJnL._AC_SL1500_.jpg,https://m.media-amazon.com/images/I/61hU+Xt6j7L._AC_SL1500_.jpg,https://m.media-amazon.com/images/I/61f06WPr3OL._AC_SL1500_.jpg,Merkloos,8410900587044,4-8d
BOL2-MJ-K0297-250618-02,BOL2-MJ-K0297-250618-02,"Gezichtsmassager, 45¡ãC Lifting met 4 standen Anti-rimpel apparaat LED Beauty Gezichtsmassager EMS Gezichtsapparaat voor Vrouwen Mannen rose","<p>¡¾Massagestanden¡¿De gezichtsmassager heeft 4 massagestanden: Clean, EMS, HOT en Skin Rejuvenation. Ze kunnen worden gebruikt om pori?n te reinigen, de huid te ontspannen en te verstevigen, je huid stralend te houden en rimpels in gezicht en hals te verbeteren
en te verminderen.</p>
<p>¡¾Dubbele kinverwijderaar¡¿De Gua Sha 4-in-1 gezichtsmassager heeft een constante temperatuur van 45 ¡ãC. De unieke gebogen massagekop glijdt moeiteloos over je gezicht en verbetert de absorptie van cr¨¨mes en lotions.</p>
<p>¡¾Draagbaar ontwerp¡¿Dankzij het ergonomische ontwerp ligt onze gezichtsmassager comfortabel in de hand en is hij moeiteloos te gebruiken. Het apparaat weegt slechts 70 g, of je hem nu in je make-uptasje op reis gebruikt of bij verschillende gelegenheden.</p>
<p>¡¾Gebruiksvriendelijk¡¿Breng je favoriete huidverzorgingsproducten eenvoudig aan op je hals en gezicht en laat ze volledig in je huid trekken. Gebruik vervolgens de massagekop van het apparaat om de nek voorzichtig van onder naar boven op te tillen en te
modelleren.</p>
<p>gezichtsmassageapparaat</p>
<p>anti-rimpelapparaat voor het gezicht</p>
<p>gezichtsliftapparaat</p>",25.47 ,100 ,https://cbu01.alicdn.com/img/ibank/O1CN01d1TO9a1UW2dlPVrhz_!!2215891042524-0-cib.jpg,https://s.alicdn.com/@sc04/kf/H8807c1dcb43a4ad3ae867b8ce1ca4e45u.jpg_720x720q50.jpg,https://s.alicdn.com/@sc04/kf/Hf178b56e55c6458d9fda0c43a6fbf776b.jpg_720x720q50.jpg,https://s.alicdn.com/@sc04/kf/Hd44b17607061472d995ce1d47a3a4918e.jpg_720x720q50.jpg,https://s.alicdn.com/@sc04/kf/Hfe7c05d45a4349e2a8b7d78332b47c99C.jpg_720x720q50.jpg,Merkloos,8410900587051,4-8d
BOL2-MJ-K0297-250618-03,BOL2-MJ-K0297-250618-03,"Elektrische Gua Sha gezichtsbehandelingstool, verbeterde warme en koude dual-mode gezichts- en halsmassager, gezichtssculptingtool/liftapparaat - verwarmd, ijs, vibrerend en rode massager, anti-veroudering en rimpels, wallen, dubbele kin","<p>Innovatief ontwerp met warme en koude kompressen - Deze gua sha gezichtsbehandeling biedt zowel warme als koude kompressen. Het warme kompres bevordert de bloedsomloop, ontspant spieren, opent pori?n en verbetert de huidtint, terwijl het ijskompres de
pori?n vernauwt, zwelling vermindert, de huid verzacht en de stevigheid verbetert. Gebruikers kunnen kiezen uit verschillende modi op basis van hun huidbehoeften, wat de effectiviteit van traditionele gua sha verbetert en veelzijdigheid toevoegt aan
de dagelijkse huidverzorging.</p>
<p>Meerdere modi beschikbaar - Dit faceliftapparaat biedt meerdere verzorgingsmodi voor verschillende huidbehoeften. Modus 1 combineert warmte en rood om de bloedsomloop te stimuleren, de huid te kalmeren en de elasticiteit en helderheid te verbeteren. Modus
2 gebruikt ijs en blauw om pori?n te verkleinen, spanning te verlichten en de gevoelige huid te herstellen. Modus 3 gebruikt MICRO en paars om de huid te verstevigen, te liften en diep te herstellen. Modus 4 combineert warmte, MICRO en rood voor anti-aging,
lifting en versteviging. Vibratie kan aan elke modus worden toegevoegd voor betere resultaten.</p>
<p>Bionisch ontwerp - De rand van deze Gua Sha gezichtsmassager is ontworpen om zich aan te passen aan de ronding van het gezicht, waardoor u meer mogelijkheden heeft. De punt kan acupunctuurpunten masseren en meridianen uitbaggeren. De behuizing past zich
aan de ronding van de handpalm aan, voor een comfortabele grip en eenvoudig gebruik.</p>
<p>Uw cadeau, haar knuffel - Deze lichtgewicht, compacte Gua Sha-tool is ideaal voor gebruik na een bad, op kantoor of op reis. Hij wordt geleverd met een USB-oplaadkabel, waarmee u hem tot wel een week kunt gebruiken met ¨¦¨¦n keer opladen. De set is verpakt
in een mooie geschenkdoos en bevat een Gua Sha-tool met twee standen: warm en koud, een USB-kabel en een gebruikershandleiding.</p>
<p>Let op: Om overmatige stimulatie van de huid te voorkomen, is een automatische uitschakeling van 5 minuten in de ijsmodus en 10 minuten in de andere modi ingesteld. Om het ijseffect te behouden, blijft de ventilator na het uitschakelen nog 30 seconden
draaien om warmte af te voeren. Dit is normaal, dus u kunt hem gerust gebruiken. Het elektrische schraperinstrument heeft drie versnellingen. Het is raadzaam om bij het eerste gebruik te beginnen met de lage versnelling!</p>",43.41 ,100 ,https://m.media-amazon.com/images/I/61CQKfDvxaL._AC_SL1500_.jpg,https://m.media-amazon.com/images/I/718v-SvIXpL._AC_SL1500_.jpg,https://m.media-amazon.com/images/I/712fgrHRsVL._AC_SL1500_.jpg,https://m.media-amazon.com/images/I/81dxnK2bkRL._AC_SL1500_.jpg,https://m.media-amazon.com/images/I/71N4vw4TD3L._AC_SL1500_.jpg,Merkloos,8410900587068,4-8d
BOL2-MJ-K0297-250618-04,BOL2-MJ-K0297-250618-04,"4D Facial Beauty Roller Massager ¨C Dubbele kogel nekliftapparaat met 12 massagestanden, 5 vibratieniveaus en 9 intensiteitsinstellingen voor gezichts- en lichaamsmodellering (zilver)","<p>?? Innovatief 4D-ontwerp met dubbele bal ¨C De voorgevormde roller past zich aan je gezicht en lichaam aan en richt zich op ogen, neus, wangen, nek, armen, taille, benen en schouders voor een verstevigende, modellerende en liftende ervaring.</p>
<p>?? 12 massagestanden en 5 vibratieniveaus ¨C Pas je routine aan met instelbare instellingen om de bloedsomloop, lymfedrainage en spierontspanning te bevorderen, wallen te verminderen en de huidelasticiteit te verbeteren.</p>
<p>?? Ergonomische grip en duurzame batterij ¨C De antisliphandgreep zorgt voor eenvoudige bediening, terwijl de oplaadbare batterij met hoge dichtheid tot een week meegaat per oplaadbeurt, waardoor hij perfect is voor dagelijkse huidverzorging en lichaamsmassages.</p>
<p>?? Smart LCD-scherm ¨C Het heldere digitale scherm geeft de massagestand, het intensiteitsniveau en de batterijstatus weer, zodat je je huidverzorgingssessies moeiteloos kunt volgen.</p>
<p>&nbsp;?? Gebruiksaanwijzing &amp; oplaadtips ¨C Voor het beste resultaat dagelijks 5-10 minuten gebruiken na het aanbrengen van serum, olie, gel of gezichtsmasker. Vermijd snelladers ¨C gebruik een 5V/1A-lader om de batterij langer mee te laten gaan.</p>",35.80 ,100 ,https://cbu01.alicdn.com/img/ibank/O1CN01fTmKGa1J48fABpVEa_!!2211175050974-0-cib.jpg,https://cbu01.alicdn.com/img/ibank/O1CN01fTmKGa1J48fABpVEa_!!2211175050974-0-cib.jpg,https://cbu01.alicdn.com/img/ibank/O1CN01aS0bqV1J48fCgPc3S_!!2211175050974-0-cib.jpg,https://cbu01.alicdn.com/img/ibank/O1CN01uSp2s61J48fGi3TaB_!!2211175050974-0-cib.jpg,https://cbu01.alicdn.com/img/ibank/O1CN01mCMLFs1J48fCfZSKU_!!2211175050974-0-cib.jpg,Merkloos,8410900587075,4-8d
BOL2-MJ-K0297-250618-05,BOL2-MJ-K0297-250618-05,"Elektrische V-gezichtsvormende massage, EMS-onderkinverkleiner, microstroom-faceliftapparaat, 45¡ãC rood- en blauwlichttherapie, kaaklijntrainer met 5 standen, 15 instelbare intensiteiten en afstandsbediening","<p>?¡¾5 EMS-massagestanden¡¿De V-face lifting massager heeft 5 standen: automatische stand, kneedstand, massagestand, acupunctuurstand en klopstand. De laagfrequente vibratiemassage verstevigt je huid, vermindert zwellingen, lift en vormt, en gaat veroudering
tegen. Kies de juiste stand op basis van jouw behoeften om je leven comfortabeler te maken.</p>
<p>?¡¾Microstroom massagekop &amp; externe pulsmassagepleister¡¿De elektrische facelifter maakt gebruik van het principe van EMS-microstroomstimulatie om de elasticiteit van de gezichtsspiervezels te verbeteren en de huidcontouren te verstevigen. Hij heeft
15 intensiteiten en is geschikt voor alle soorten mensen. Tijdens het gebruik van de facelifter kun je de externe pulsmassagepleister bevestigen en deze op de gewenste positie plakken (zoals: rug, armen, dijen, kuiten, taille en andere posities).
Zo geniet je optimaal.&nbsp;</p>
<p>?¡¾Ergonomisch ontwerp¡¿De V-vormige massager maakt gebruik van een intelligent ontwerp met een constante temperatuur van 45 ¡ãC, wat de huidpori?n opent, de absorptie bevordert en gezichtszwelling kan verminderen. Het 180¡ã opvouwbare ringontwerp past beter
bij de kincurve en volgt de menselijke gezichtscurve; het past perfect bij de gezichtscontour, waardoor het liftende effect duidelijker zichtbaar is.</p>
<p>?¡¾Eenvoudige bediening¡¿Gebruik bij het eerste gebruik van de gezichtsmassager een vochtig doekje om de massagekop te bevochtigen; het apparaat aan-/uitzetten: houd de aan/uit-knop 5 seconden ingedrukt; selecteer de modus: druk kort op de modusknop; pas
de intensiteit aan: druk kort op de +/- knop.</p>
<p>?¡¾Verpakking &amp; Gemakkelijk mee te nemen¡¿De verpakking bevat: Elektrische V-vormige massager*1, Afstandsbediening*1, Elastische band*1, Externe pulsinterfacekabel*1, Pulsmassagepatch*2, USB naar USB-C oplaadkabel*1, Gebruiksaanwijzing*1. De V-face
massager is opvouwbaar en opbergbaar. Je kunt hem meenemen naar je werk, tijdens je vrije tijd en op reis, en je huid altijd en overal masseren.</p>",33.34 ,100 ,https://m.media-amazon.com/images/I/71qJBDDhwOL._AC_SL1500_.jpg,https://m.media-amazon.com/images/I/71z7lXDT-oL._AC_SL1500_.jpg,https://m.media-amazon.com/images/I/71gLpqDrY9L._AC_SL1500_.jpg,https://m.media-amazon.com/images/I/71lYeYRqwgL._AC_SL1500_.jpg,https://m.media-amazon.com/images/I/711n+4yOCPL._AC_SL1500_.jpg,Merkloos,8410900587082,4-8d
BOL2-MJ-K0297-250618-06,BOL2-MJ-K0297-250618-06,"Dubbele kin verwijderend apparaat Elektrisch facelift apparaat Elektrische V-face dubbele kin verwijderend apparaat Intelligent liftend verstevigend huidmodellerende dubbele kin, wit","<p>Verstevigt het gezicht: De Double Chin Eliminator maakt gebruik van magnetische massagetechnologie die diep in de gezichtshuid doordringt met microstromen om het gezicht te kalmeren en de huidelasticiteit te verbeteren, waardoor uw gezicht er strakker
en voller uitziet.</p>
<p>Geschikt voor veel gezichtsproblemen: De Double Chin Eliminator is geschikt voor de algehele verbetering van de gezichtshuid en het verhogen van de gezichtselasticiteit, geschikt voor spierhypertrofie, vergroting van de frontale spieren, spierontspanning
en het behandelen van een onzuivere huid.</p>
<p>Perfect comfortabel ontwerp: De faceliftmachine is ergonomisch ontworpen en past zich perfect aan de gezichtsvorm aan. De linker- en rechterkant zijn symmetrisch gewikkeld voor een effectievere lifting.</p>
<p>Gebruiksvriendelijk: Het faceliftapparaat is lichtgewicht en USB-oplaadbaar, en is perfect voor thuis, op kantoor of op reis. Het wordt aanbevolen om het 15 minuten per dag te gebruiken, u kunt het gebruiken tijdens het lezen, slapen, tv kijken, huishoudelijk
werk of op elk gewenst moment.</p>
<p>6 modi: Onze Double Chin Eliminator biedt 6 modi die u vrij kunt combineren. U kunt de juiste modus kiezen op basis van uw persoonlijke behoeften. Voor beginners is het raadzaam om te beginnen met de laagste intensiteit.</p>",28.43 ,100 ,https://s.alicdn.com/@sc04/kf/H02e3dc4d31fd48f29a56009b430133a78.jpg_720x720q50.jpg,https://m.media-amazon.com/images/I/614KE8DjJ-L._AC_SL1300_.jpg,https://m.media-amazon.com/images/I/61ndVMhui3L._AC_SL1300_.jpg,https://m.media-amazon.com/images/I/51wYzYBekvL._AC_SL1300_.jpg,https://m.media-amazon.com/images/I/61kOV+Wzr4L._AC_SL1300_.jpg,Merkloos,8410900587099,4-8d
BOL2-MJ-K0297-250618-07,BOL2-MJ-K0297-250618-07,"Dubbele kin verwijderaar Roller V-face lift apparaat, 3 EMS modi Gezichtsmassager, Dubbele kin versteviger voor anti-rimpels Vaarwel aan grote en kleine gezichten Gezichtsafslanking","<p>Heb je last van een dubbele kin of een oneffen gezicht? Onze gezichtsmassager met EMS-technologie helpt specifiek tegen een dubbele kin en een slappe huid. De combinatie van massage en microstroom stimuleert de bloedsomloop, bevordert de lymfestroom en
helpt kleine probleemzones glad te strijken.</p>
<p>V-vormige gezichtsvorm voor gedefinieerde contouren: Het faceliftapparaat modelleert zachtjes een V-vormig gezicht. Bij regelmatig gebruik wordt de huid strakker en gelift om een ??smaller gezicht te vormen.</p>
<p>Effectieve dubbele kinverwijderaar voor duidelijke gezichtslijnen: Zeg vaarwel tegen een dubbele kin! Dit apparaat combineert EMS met rolmassage om specifiek vetophopingen in de kin te verwijderen en tegelijkertijd de huid te verstevigen. Bovendien vermindert
het zichtbare rimpels in de nek.</p>
<p>Gezichtsmassager met 3 EMS-modi: Stand 1 is ideaal voor beginners, stand 2 biedt intensere resultaten na enige gewenning. De derde stand is geschikt voor de bottleneckfase, wanneer het gezicht enigszins dun is. Zo past het apparaat zich flexibel aan je
huid en je doel aan.</p>
<p>Gezichtsrollermassage - verstevigend en ontspannend: slechts 15 minuten per dag. De zachte massage zorgt voor een egale teint, vermindert spanningen en zorgt ervoor dat het gezicht er fijner uitziet - ideaal voor uw dagelijkse verzorgingsroutine.</p>",32.81 ,100 ,https://m.media-amazon.com/images/I/71qV9cBl72L._AC_SL1500_.jpg,https://m.media-amazon.com/images/I/71yA6fQVl1L._AC_SL1500_.jpg,https://m.media-amazon.com/images/I/71Fi2PG4hlL._AC_SL1500_.jpg,https://m.media-amazon.com/images/I/71YccvJfZYL._AC_SL1500_.jpg,https://m.media-amazon.com/images/I/71do5NWsNTL._AC_SL1500_.jpg,Merkloos,8410900587105,4-8d
BOL2-MJ-K0297-250618-08,BOL2-MJ-K0297-250618-08,Tweekleurig lichtmicrostroom gezichtsapparaat Blauw licht verbetert het vermogen om het gezicht te liften en de huid te verstevigen Massageapparaat voor gezichtshuidversteviging Gezichtsrimpelapparaat USB - Wit,"<p>¡¾Slimme vibratiemicrostroom¡¿Microstroom gezichtsmassage met blauw licht en andere kleuren licht kan veroudering effectief vertragen. Het vermindert rimpels, verbetert een slappe huid, vermindert een dubbele kin, zorgt voor een stralende uitstraling en
verhoogt de opname van gezichtsverzorgingsproducten.</p>
<p>¡¾Verschillende liftfuncties¡¿ Tweekleurig licht, ge?ntegreerd knopontwerp, gebruiksvriendelijk. Onze microstroom gezichtsliften verstevigen en verjongen de huid, zodat u een mooi uiterlijk behoudt.</p>
<p>¡¾Gezichts-/lichaamsmassage¡¿ De gezichtsliftmassage is niet alleen geschikt voor het gezicht, maar ook voor het voorhoofd, de ogen, de nek, de neuslippenplooien, de armen, de buik, de taille, de benen en de dijen. Helpt fijne lijntjes, kragen, doffe huid,
zwarte lijnen, rimpels, striae en kraaienpootjes te verminderen.</p>
<p>¡¾Gezichtsmassage¡¿De microstroom gezichtsmassage lift en verstevigt de huid zachtjes, verbetert de huid, vermindert fijne lijntjes, houdt de huid jong en maakt uw huid levendig en stralend.&nbsp;</p>
<p>¡¾Draagbaar gebruik¡¿Dankzij het compacte en stijlvolle ontwerp kunt u het apparaat gemakkelijk thuis of onderweg meenemen, zodat u kunt genieten van uw eigen professionele huidverzorgingssalon.</p>",21.83 ,100 ,https://m.media-amazon.com/images/I/71ERdE6tyVL._AC_SL1500_.jpg,https://m.media-amazon.com/images/I/716+Z0eq9uL._AC_SL1500_.jpg,https://m.media-amazon.com/images/I/71Nw8uOojQL._AC_SL1500_.jpg,https://m.media-amazon.com/images/I/71XUNMTuPCL._AC_SL1500_.jpg,https://m.media-amazon.com/images/I/71vE6zMLc+L._AC_SL1500_.jpg,Merkloos,8410900587112,4-8d
BOL2-MJ-K0297-250618-09,BOL2-MJ-K0297-250618-09,"Face Lift Belt - EMS ElectricV-Face Shaping Massager - Apparaat voor het afslanken van het gezicht en de dubbele kin voor versteviging, anti-rimpels, ontspant bijtende spieren en keert huidveroudering om","<p>VERSTEVIGEND EN LIFTEND: De elektrische V Face Lift Belt verstevigt en lift de huid aanzienlijk, waardoor een dubbele kin, een slappe huid en lachrimpels worden verminderd. Het herstelt de huidelasticiteit en helpt een strakkere kaaklijn te cre?ren.</p>
<p>DIEPE ABSORPTIE: De Face Lifting Machine maakt gebruik van TENS-technologie om de dermale laag van het gezicht te stimuleren en de aanmaak van ATR en collageen te bevorderen. Dit verbetert de huidelasticiteit, stimuleert de collageenregeneratie en vermindert
vet. Het vergemakkelijkt ook de diepe absorptie van huidverzorgingsproducten, waardoor voedingsstoffen beter in de basislaag van de huid kunnen doordringen en de algehele absorptie wordt verbeterd.</p>
<p>UITGEBREIDE GEZICHTSVERZORGING: Het gezichtsliftapparaat beschikt over zes verzorgingsstanden (tikken, liften, kneden, verstevigen en cyclisch) en negen niveaus van laagfrequente pulsaanpassing, wat zorgt voor een precieze en comfortabele verzorging van
verschillende delen van het gezicht en helpt bij het cre?ren van een perfect V-vormig gezicht.</p>
<p>COMFORTABEL EN ADEMEND: Het gezichtsafslankapparaat is gemaakt van zeer veerkrachtig lycra dat huidvriendelijk, ademend en vrij van strepen is. Het zorgt voor comfortabel dragen en verbetert de huidondersteuning. De strenge vakmanschap garandeert een
goede pasvorm met 360¡ã fysieke rekbaarheid en geen terugvering, waardoor de gezichtshuid vol en elastisch blijft.</p>
<p>MEERDERE MODI: Kinband voor dubbele kin, dames en heren. Het ondersteunt zowel de halve als de volledige gezichtsmodus en pakt specifieke problemen aan, zoals een dubbele kin en neuslippenplooien. Het apparaat is voorzien van vaste plakstrips voor eenvoudige
verwijdering en gelijkmatige druk, en naadloze ooruitsparingen voor comfort. Het verbetert de stabiliteit van het masker en is geschikt voor verschillende gezichtsvormen.</p>",83.47 ,100 ,https://cbu01.alicdn.com/img/ibank/O1CN01Tp9TIq1FC9CozrM4F_!!2216963950450-0-cib.jpg,https://s.alicdn.com/@sc04/kf/H0947b68828d14169ac0e637a1a4dec28V.jpg_720x720q50.jpg,https://s.alicdn.com/@sc04/kf/Hd93e50e232594dcea9051037fa8ab137b.jpg_720x720q50.jpg,https://s.alicdn.com/@sc04/kf/Heec8e67f65ae4642aa745c2b7d552810I.jpg_720x720q50.jpg,https://s.alicdn.com/@sc04/kf/H8e765c5eeeff48ca92db0b4465987aefP.jpg_720x720q50.jpg,Merkloos,8410900587129,4-8d
BOL2-MJ-K0297-250618-10,BOL2-MJ-K0297-250618-10,"Elektrische V-vormige gezichtsmassager, EMS-onderkinverkleiner, rood-blauwe lichttherapie LED-huidverstevigingsapparaat, gezichtsmassager met 6 standen en afstandsbediening, kaaklijntrainer, rood","<p>4 EMS-lifttechnieken, anti-rimpel en anti-aging: De V-lijn facelift massager heeft een tui na-modus, kneedmodus, acupunctuurmodus, klopmodus; laagfrequente vibratiemassage, ontspant de huid, vermindert zwelling, lift en vormt; de lifttechniek die menselijke    handen simuleert is comfortabeler.</p>
<p>EMS-microstroom + vibratie: Dit facelift apparaat kan EMS-microstroom afgeven om de gezichtsspieren te stimuleren, de collageenactiviteit te activeren en de huid te verstevigen. Door vibratie verzacht het de gezichtsspieren, verbetert het de fijne spieren    en de gezichtselasticiteit, lift en verstevigt het de gezichtsspieren volledig.</p>
<p>Rood en blauw lichttherapie: De rode lichtmodus lift en verstevigt, bevordert de collageenproductie en herstelt de huidelasticiteit; de blauwe lichtmodus reinigt en verwijdert acne, remt ontstekingen en kalmeert de huid.</p>
<p>Ideale cadeau-opties: Ergonomisch ontwerp, past perfect bij de contouren van het gezicht, de opvouwbare ringvorm past bij alle gezichtsvormen en de lengte van de hoofdband is verstelbaar. Geef je dierbaren schoonheid en zelfvertrouwen cadeau.</p>
<p>Hoe maximaliseer je de effectiviteit van EMS: Het wordt aanbevolen om deze EMS roodlichttherapie gezichtsmassager na het reinigen te gebruiken met gel voor een beter effect. Het versterkt de EMS-stroom en maakt het gemakkelijker om EMS te voelen.</p>",39.20 ,100 ,https://m.media-amazon.com/images/I/61W0HsMKARL._AC_SL1500_.jpg,https://m.media-amazon.com/images/I/71EfHJxgQOL._AC_SL1500_.jpg,https://m.media-amazon.com/images/I/61ofCHz-pWL._AC_SL1500_.jpg,https://m.media-amazon.com/images/I/71nGAEJHzpL._AC_SL1500_.jpg,https://s.alicdn.com/@sc04/kf/H60d86be2f61744178d23d6f56cb8d83aq.jpg_720x720q50.jpg,Merkloos,8410900587136,4-8d
BOL2-MJ-K0297-250618-11,BOL2-MJ-K0297-250618-11,"Gezichtsapparaat Gua Sha Elektrisch, EMS Microstroom Gezichtsschraper Massager, Gezichtsmodelleringsapparaat met Warme & Koude Kompressen en Hoogfrequente Vibratie, Gezichts- & Lichaamsmassager voor Anti-Aging en Toning","<p>¡¾DUBBEL VERZORGING: WARM EN KOUD¡¿: De elektrische gezichtsmassager heeft 2 standen: koud en warm. Warme stand: 38~46 ¡ãC. Het kan de celvitaliteit verbeteren en de opname van huidverzorgingsproducten bevorderen. Volledige lichaamsmassage, meridianen kalmeren
en de bloedsomloop bevorderen. IJsherstel: 15~20 ¡ãC. Het kan pori?n verkleinen, allergie?n verminderen, oedeem elimineren en de huid jeugdig en mooi houden met een koel gevoel.</p>
<p>¡¾EMS-MICROSTROOMLIFTING MET 3 SNELHEDEN¡¿: De elektrische schrapende massager heeft EMS-microstroomstanden met 3 snelheden, die oedeem kunnen elimineren, de huid kunnen liften en verstevigen en gladde gezichtslijnen kunnen vormen; tegelijkertijd kan het
de opname van huidverzorgingsproducten diepgaand bevorderen en het effect ervan verbeteren. De lage snelheid van de elektrische schrapende steen is geschikt voor de gevoelige huid, de gemiddelde snelheid is geschikt voor de vette/neutrale huid en
de hoge snelheid is geschikt voor een huid met een hoge tolerantie.</p>
<p>¡¾3-NIVEAUS VIBRATIEMASSAGE¡¿: De verwarmde schrapende massager kan lichaam en geest diep ontspannen. Druk lang op de modusknop om de hoogfrequente vibratiemassage in te schakelen, lichaam en geest diep te ontspannen, de stevigheid en elasticiteit te verhogen
en de huid snel te verzorgen. Niveau 1 - zacht kalmerend, herstelt de vitaliteit van de huid. Niveau 2 - Verbetert de bloedsomloop en verbetert het absorptievermogen van de huid. Niveau 3 - Verhoogt de stevigheid en elasticiteit, effectieve verzorging
en snelle verzorging.</p>
<p>¡¾3-KLEUREN LICHTTHERAPIE¡¿: Het gezichtsliftapparaat heeft 3-kleuren lichttherapie, rood licht 622nm verwarming, activeert collageen en verhoogt de huidelasticiteit. Blauw licht 460nm ijskompres, antibacterieel en ontstekingsremmend, herstelt de huid.
Paars licht 470nm EMS microstroom, vermindert rimpels en verheldert de teint.&nbsp;</p>
<p>¡¾COMFORTABELE EN INTIEME MASSAGE¡¿: De elektrische schrapende en verstevigende machine heeft een ergonomisch golvend ontwerp dat perfect en comfortabel aansluit op de contouren van gezicht en lichaam. Het is zeer geschikt voor gebruik op nek, gezicht,
kin, rug en ledematen. Gebruik de gezichtsmassager 10-15 minuten per dag om uw huid te verjongen.</p>",44.39 ,100 ,https://m.media-amazon.com/images/I/61Ecp0oichL._AC_SL1500_.jpg,https://m.media-amazon.com/images/I/61vYcpl8BnL._AC_SL1001_.jpg,https://m.media-amazon.com/images/I/61aJ-SpVq3L._AC_SL1001_.jpg,https://m.media-amazon.com/images/I/61jP-pKx43L._AC_SL1001_.jpg,https://m.media-amazon.com/images/I/61Xfyva1PFL._AC_SL1001_.jpg,Merkloos,8410900587143,4-8d
