internereferentie,sku,title,description,price,stock,image 1_link,image 2_link,image 3_link,image 4_link,image 5_link,brand,ean,delivery_time
BOL2-MJ-K0297-250618-24,BOL2-MJ-K0297-250618-24,"7-kleuren LED-lichttherapiemasker, schoonheidsfotonisch masker voor huidverjonging, anti-veroudering, acne, vlekken, littekenverwijdering, verstevigend gezichtsmasker","<p>Veilig en natuurlijk, comfortabel en gemakkelijk te gebruiken: het masker maakt gebruik van lineaire lichtgeleiders die via leds in de huid worden geleid. Het is niet schadelijk voor uw ogen. Elke lichtkleur heeft een gunstig effect op specifieke huidaandoeningen.    Uw huid absorbeert lichtenergie, die vervolgens de conditie van uw huid behandelt, afhankelijk van de gebruikte kleur.</p>
<p>7-kleuren ledmasker: professioneel ledmasker, maakt gebruik van lineaire lichtgeleiders. Verkrijgbaar in rood, blauw, groen, paars, geel, cyaan en wit. Elke lichtkleur heeft een gunstig effect op specifieke huidaandoeningen.</p>
<p>Helpt huidproblemen te verbeteren: Ontworpen om het gezicht te verfraaien, de glans en elasticiteit van de huid te vergroten, rimpels te verminderen en te voorkomen, de huid te verstevigen, donkere kringen, wallen, fijne lijntjes, donkere vlekken en droge    plekjes te verminderen, acne te remmen, de opname van huidverzorgingsproducten te versnellen en de slaapkwaliteit te verbeteren.</p>
<p>Activeert collageen: bevordert de collageengroei in de huid, waardoor deze transparanter en helderder wordt. Verjong en revitaliseer de rendieren! Helpt bij een jeugdige en stralende teint. Geschikt voor alle huidtypen, lichtgewicht, veilig en comfortabel.</p>
<p>Gebruiksvriendelijk: dit ledmasker is draadloos en overal te gebruiken. E¨¦n knop om het masker te bedienen. Geschikt voor alle huidtypen, lichtgewicht, veilig en comfortabel.</p>",42.39 ,100 ,https://m.media-amazon.com/images/I/71gJfo6LDOL._AC_SL1500_.jpg,https://m.media-amazon.com/images/I/713-k2pjhUL._AC_SL1500_.jpg,https://m.media-amazon.com/images/I/71ObdYLIlbL._AC_SL1500_.jpg,https://m.media-amazon.com/images/I/71KHgEkKtQL._AC_SL1500_.jpg,https://m.media-amazon.com/images/I/71O0YoS5NaL._AC_SL1500_.jpg,Merkloos,8410900587273,4-8d
BOL2-MJ-K0297-250618-25,BOL2-MJ-K0297-250618-25,"Multifunctioneel gezichtsapparaat, draagbare elektrische gezichtsmassager 7-in-1 roodlichttherapie voor gezichtsmassager voor huidverzorging thuis","<p>¡¾Ontworpen voor alle huidtypen¡¿- Deze 7-in-1 gezichtsmassager kan zowel op het gezicht als op de hals worden gebruikt. Het apparaat heeft 4 verschillende ledlichtstanden met diverse huidverzorgingsfuncties, wat effectief en multifunctioneel is.</p>
<p>¡¾Dagelijkse huidverzorging¡¿- Dit apparaat helpt huidverzorgingsproducten dieper in de huid door te dringen en het maximale uit uw huidverzorgingsroutine te halen, waardoor deze gladder, stralender en egaal van kleur wordt.</p>
<p>¡¾Verwarmende en verkoelende gezichtsmassage¡¿- Onze gezichtsmassager biedt 7 standen, waaronder vibratie, verwarming, koeling en meer. De warmtestand helpt uw ??huid de cr¨¨me of lotion sneller en vollediger te absorberen, zodat uw huid straalt. De koele
stand gebruikt een verkoelende ijssensatie en blauw licht om wallen te verminderen, waardoor u een frissere huid krijgt. Voldoe aan uw diverse behoeften en geniet van professionele huidverzorgingsbehandelingen, altijd en overal.</p>
<p>¡¾Gebruiksaanwijzing¡¿- Reinig uw huid grondig en breng voor gebruik wat huidverzorgingsproducten aan. Houd de knop ingedrukt om het apparaat in te schakelen en de gewenste modus te selecteren. Beweeg het apparaat zachtjes in cirkelvormige bewegingen over
uw gezicht en hals.</p>
<p>¡¾Inhoud¡¿ - Inclusief 1¡Á gezichtsmassager, 1¡Á voetstuk, 1¡Á transparante borgring, 1¡Á USB-kabel en 1¡Á handleiding. Klein en lichtgewicht, gemakkelijk mee te nemen en te gebruiken voor huidverzorging thuis of op reis.</p>",44.86 ,100 ,https://m.media-amazon.com/images/I/71pGMkdl+UL._AC_SL1500_.jpg,https://m.media-amazon.com/images/I/71+P7T-e-kL._AC_SL1500_.jpg,https://m.media-amazon.com/images/I/71L+uWDL5aL._AC_SL1500_.jpg,https://m.media-amazon.com/images/I/71E1To+kqxL._AC_SL1500_.jpg,https://m.media-amazon.com/images/I/71ko0w29l2L._AC_SL1500_.jpg,Merkloos,8410900587280,4-8d
