internereferentie,sku,title,description,price,stock,image 1_link,image 2_link,image 3_link,image 4_link,image 5_link,brand,ean,delivery_time
BOL2-MJ-K0297-250618-12,BOL2-MJ-K0297-250618-12,Mee-eter verwijderaar vacu¨¹m pori?nreiniger acne comedonen extractor gezichtspori?n vacu¨¹m mee-eter verwijderaar gereedschap gezichtspori?n reiniger met 5 instelbare zuigkracht en 4 vervangende sondes - Blauw,"<p>?¡¾KRACHTIG, EFFECTIEF MAAR PIJNLOOS¡¿Gemaakt van betrouwbaar ABS-materiaal en gebruikt een effectieve fysieke aanpak om huidproblemen op te lossen zonder giftige en schadelijke chemicali?n. Het is veiliger en effectiever dan traditionele gezichtsreinigingsmethoden.
Tegelijkertijd is de hoogwaardige verpakking een verstandige keuze om cadeau te doen aan familie en vrienden.</p>
<p>?¡¾OPLAADBAAR &amp; DRAAGBAAR met LED-DISPLAY¡¿Onze pori?nreiniger heeft een ingebouwde, via USB oplaadbare lithiumbatterij. Ongeveer 2 uur opladen zorgt voor meer dan 3 uur superlange standby-tijd. Het draagbare ontwerp neemt niet veel ruimte in beslag
en is gemakkelijk mee te nemen. Het visuele LED-display toont de gebruiksduur en de resterende batterijduur en helpt u de sterkte te controleren.</p>
<p>?¡¾¨¦¨¦N SET VOOR ELKE GEZICHTSHUID¡¿In tegenstelling tot traditionele brute-force zuigtechnieken, is de nieuwste generatie mee-eterzuiger ontworpen om mee-eters uit uw huid te zuigen zonder deze te beschadigen. Verwijdert diep hardnekkige mee-eters, whiteheads,
acne, dode huidcellen en make-upresten en maakt je huid stralender.</p>
<p>?¡¾Nieuwste beautytechnologie¡¿De nieuwste mee-eter-vacu¨¹mverwijderaar is een multifunctioneel apparaat voor gezichtsverzorging met krachtige zuigpatronen en sondes voor een diepere reiniging van de huid. Na tests uitgevoerd door meer dan 1000 gebruikers,
kan deze mee-eter-vacu¨¹mreiniger effectief hardnekkige mee-eters, whiteheads, dode huidcellen, vet, puistjes, comedonen en make-upresten verwijderen, rimpels gladstrijken en de huid strakker maken, zelfs na wekenlang continu gebruik.</p>
<p>? [5 zuigkrachtniveaus] De pori?nvacu¨¹m is ontworpen voor verschillende huidtypen. De lichte zuigkrachtniveaus 1 en 2 zijn geschikt voor de gevoelige en droge huid. Gebruik de eerste keer de beautysonde met kleine opening. De gemiddelde zuigkracht, niveau
3, is voor een neutrale huid. Het hoge zuigniveau, niveau 4, is voor een vette huid, en het sterkste zuigniveau, niveau 5, is ontworpen voor een gemengde huid met grote pori?n.</p>",32.10 ,100 ,https://cbu01.alicdn.com/img/ibank/O1CN01OlLFQj2IKnbosL7HI_!!2723889268-0-cib.jpg,https://cbu01.alicdn.com/img/ibank/O1CN019WUNG92IKniSeKEvg_!!2723889268-0-cib.jpg,https://m.media-amazon.com/images/I/61K07pCtQzL._AC_SL1500_.jpg,https://i.postimg.cc/dQys7cng/9-1.jpg,https://i.postimg.cc/tCGXWvMJ/8-2.jpg,Merkloos,8410900587150,4-8d
BOL2-MJ-K0297-250618-13,BOL2-MJ-K0297-250618-13,"Elektrische fascia-messchraper Gua Sha-tool, 4 standen - Rood model + Paars + Blauw + Verwarming + Micro + Trilling - 3-traps aanpassing - USB-oplaadbaar, Spierontspanningstool, Fascia-massager","<p>Multifunctionele massagetool - Vergeleken met traditionele GuaSha-tools is deze elektrische GuaSha-schraper met fasciames zwaarder en gemaakt van metaal (0,9 pond), dat een zeer fijne structuur heeft. Het ergonomische ontwerp maakt het geschikt voor het
schrapen van spieren en het masseren van het hele lichaam. Het kan op elk lichaamsdeel worden toegepast, zoals de nek, gewrichten, taille, benen, armen, handen, schouders en rug. Het kan worden gebruikt voor schrapen, spierontspanning, een volledige
lichaamsmassage, enz.</p>
<p>Meerdere modi beschikbaar - Deze GuaSha-spiermassage-ontspanningstool heeft 4 modi: rood licht, rood licht + verwarming, paars + MICRO en paars + verwarming + MICRO. Elke modus heeft een ander effect en u kunt eenvoudig wisselen. Elke modus heeft 3 instelbare
standen, u kunt de juiste intensiteit kiezen op basis van uw behoeften. (Bij het eerste gebruik van de massager is het raadzaam om te beginnen met een lagere stand en deze geleidelijk te verhogen, afhankelijk van de tolerantie van uw lichaam.)</p>
<p>Breed toepasbaar - Geschikt voor spierblessures veroorzaakt door intensieve training, fysiotherapie en pijnverlichting tijdens de herstelperiode na een operatie. Ook bij fysieke en mentale uitputting door werk. Het beste cadeau voor zittend kantoorpersoneel,
professionele atleten en fitnessliefhebbers.</p>
<p>Draagbaar en duurzaam - Deze fascia gua sha massagetool is zeer klein, met een afmeting van slechts 16,3 x 5,6 x 3 cm, en past gemakkelijk in een kleine tas of zak. Of u nu op zakenreis bent, op reis bent of op kantoor bent, u kunt hem altijd en overal
gebruiken. 1200 mAh lithiumbatterij met grote capaciteit, 30 minuten per dag, goed voor 20 dagen gebruik. Snel opladen via USB, eenvoudig en handig.</p>",54.41 ,100 ,https://cbu01.alicdn.com/img/ibank/O1CN01DPae1E2IKnj62UxQT_!!2723889268-0-cib.jpg,https://m.media-amazon.com/images/I/711pCPG0CdL._AC_SL1500_.jpg,https://m.media-amazon.com/images/I/81G4aNdfyVL._AC_SL1500_.jpg,https://m.media-amazon.com/images/I/81LOxl2xrtL._AC_SL1500_.jpg,https://m.media-amazon.com/images/I/8100kVq95NL._AC_SL1500_.jpg,Merkloos,8410900587167,4-8d
BOL2-MJ-K0297-250618-14,BOL2-MJ-K0297-250618-14,"Elektrische Gua Sha gezichtsbehandelingstool 7-in-1 warme en koude LED-schoonheidsmassage voor gezicht en hals, vibrerende pulsmodus voor huidverzorging, lymfedrainage, anti-aging en rimpels, faceliftapparaat","<p>Warm en koud kompres - Deze gua sha gezichtsmassager heeft een warm en koud kompres. Het warme kompres bevordert de bloedcirculatie, ontspant spieren, opent pori?n en verbetert de huidtint. Het ijskompres sluit pori?n, vermindert zwellingen, kalmeert
de huid en maakt deze steviger. Dankzij het roestvrij staal is het snel en gemakkelijk op te warmen. U kunt kiezen tussen warm en koud, afhankelijk van uw huidtype. Dit maakt gua sha effectiever en gemakkelijker te gebruiken, elke dag.</p>
<p>Meerdere modi beschikbaar - Dit beautyapparaat heeft 7 modi, elk met een andere kleur. Elke modus heeft een andere temperatuur, sterkte en werkingssnelheid. Dit product kan uw huid er gezonder en jonger uit laten zien. Het kan ook uw pori?n verkleinen,
spanning verminderen en een gevoelige huid herstellen. Het verstevigt, lift en herstelt de huid diep.</p>
<p>Ergonomisch ontwerp - De rand van deze Gua sha gezichtsmassager is ontworpen om zich aan te passen aan de vorm van uw gezicht, waardoor u meer mogelijkheden heeft. De punt kan acupunctuurpunten masseren en meridianen uitbaggeren. De handgreep past perfect
in de handpalm, voor een comfortabele grip en eenvoudig gebruik. Puur en natuurlijk - Guasha is een eeuwenoude fysiotherapie uit het Oosten. Dit product combineert moderne technologie met traditionele massagetechnieken, zoals een facelift en lymfedrainage,
gecombineerd met blootstelling aan rood en blauw licht en temperatuurtherapie om de conditie van uw huid op natuurlijke wijze te verbeteren.</p>",45.63 ,100 ,https://m.media-amazon.com/images/I/612FkH-buFL._AC_SL1500_.jpg,https://m.media-amazon.com/images/I/71vPEzA+udL._AC_SL1500_.jpg,https://m.media-amazon.com/images/I/61eTqQ3zlFL._AC_SL1500_.jpg,https://m.media-amazon.com/images/I/71JIoRXegXL._AC_SL1500_.jpg,https://m.media-amazon.com/images/I/71s0NBT-WpL._AC_SL1500_.jpg,Merkloos,8410900587174,4-8d
BOL2-MJ-K0297-250618-15,BOL2-MJ-K0297-250618-15,Fasciaal mes Gua Sha massagetool Elektrische spierschraper met EMS microstroom warmtetherapie (38-46¡æ) & vibratie cellulitis massagetool Type-C oplaadbaar 3 standen Wit,"<p>Triple Therapy Technology: EMS-microstroom stimuleert spiercontractie + thermische therapie verbetert de bloedstroom + diepe vibratie verbreekt fasciale verklevingen - 30% sneller herstel dan met traditionele tools</p>
<p>Slimme temperatuurregeling: NTC-gereguleerde warmte met een instelbaar bereik van 8 ¡ãC (38-46 ¡ãC) voorkomt automatisch oververhitting en maximaliseert de therapeutische voordelen</p>
<p>Professioneel ergonomisch ontwerp: Gebogen rand vormt zich perfect naar de anatomie van het lichaam (nek/schouders/rug/benen) met 360¡ã antislipgrip</p>
<p>De hele dag door presteren: 1200 mAh batterij met realtime energieweergave + universele USB-C-oplaadfunctie (0-100% in 90 minuten)</p>
<p>Ideaal voor meerdere scenario's: Of u nu herstelt van een sportblessure, ontspanning zoekt na een intensieve training, spierstijfheid door langdurig zitten bestrijdt of helpt bij postoperatief herstel, Fascia Knife is d¨¦ oplossing voor het verzachten    van uw nek, schouders, rug, gewrichten, taille, benen, armen, handen en spieren</p>",49.15 ,100 ,https://cbu01.alicdn.com/img/ibank/O1CN01vvPC742IKnnEKjNH1_!!2723889268-0-cib.jpg,https://s.alicdn.com/@sc04/kf/Hf6301dc5ecfe4d31a3000748b9964b858.jpg_720x720q50.jpg,https://s.alicdn.com/@sc04/kf/H77cc5d74d925468ca919f6572ebef46cs.jpg_720x720q50.jpg,https://s.alicdn.com/@sc04/kf/H16897d0827f64ce6b6efc960b53db8a5z.jpg_720x720q50.jpg,https://cbu01.alicdn.com/img/ibank/O1CN015RMHuf2IKnkmaMHy7_!!2723889268-0-cib.jpg,Merkloos,8410900587181,4-8d
BOL2-MJ-K0297-250618-16,BOL2-MJ-K0297-250618-16,"Roodlichttherapie voor het gezicht, 7 modi en timerinstellingen Led-gezichtsmasker Lichttherapie met afstandsbediening, draagbaar nabij-infrarood 850 roodlichttherapiemasker, oogbescherming Lichttherapie thuis 288 LED-kralen","<p>Multi-Mode Lichttherapie voor het Gezicht: Dit geavanceerde LED-gezichtsmasker biedt 7 gespecialiseerde lichtstanden ¨C Rood (650 nm), Oranje (605 nm), Wit (500 nm), Paars (430 nm), Groen (530 nm), Blauw (470 nm) en Geel (590 nm) ¨C om diverse huidproblemen
aan te pakken. Het rode en nabij-infrarood licht werken samen om de collageenproductie te stimuleren, de huidelasticiteit te verbeteren en de uitstraling te versterken. Blauw licht helpt de talgafscheiding te reguleren, terwijl geel licht roodheid
verzacht en de gevoelige huid kalmeert, enz. Met 7 instelbare helderheidsniveaus is het perfect voor de dagelijkse verzorging van het lichaam.</p>
<p>Slimme Timer met Afstandsbediening voor Probleemloos Gebruik: Het roodlichtmasker is uitgerust met een gebruiksvriendelijke afstandsbediening, waarmee u eenvoudig behandeltijden kunt instellen die bij uw schema passen. Kies uit sessies van 5, 10 of 15
minuten en het apparaat schakelt automatisch uit aan het einde van de sessie. Deze functie zorgt voor veilig en zorgeloos gebruik, waardoor het ideaal is voor een snelle ochtendroutine of een ontspannende huidverzorging 's avonds.</p>
<p>Lichtgewicht, draagbaar en comfortabel ontwerp: Het roodlichttherapiemasker is gemaakt van zachte, hoogwaardige siliconen en past nauwsluitend en comfortabel op uw gezicht zonder druk te veroorzaken. Het meegeleverde oogbeschermingsschild zorgt voor een
veilige en aangename ervaring. Het lichtgewicht, opvouwbare ontwerp maakt het gemakkelijk mee te nemen en op te bergen, perfect voor gebruik thuis, op reis of zelfs tijdens buitenactiviteiten. Reiniging is eenvoudig: veeg het oppervlak na gebruik
af met een zachte doek of een vochtig doekje.</p>
<p>288 hoogenergetische led-kralen voor diepe huidverzorging: De roodlichttherapie voor het gezicht met 288 hoogenergetische led-kralen met een stralingsafstand van minder dan 4 mm, levert het led-lichtmasker geconcentreerde en gelijkmatige lichtenergie
die diep in de huid doordringt en de huidconditie van het hele gezicht verbetert. Het handsfree ontwerp stelt u in staat om te multitasken - lezen, sporten of ontspannen - terwijl u geniet van uw lichttherapiesessie.</p>",44.19 ,100 ,https://cbu01.alicdn.com/img/ibank/O1CN01uaevRG1ql5FiqQGG3_!!2210325835535-0-cib.jpg,https://m.media-amazon.com/images/I/71tQ3f97OKL._AC_SL1500_.jpg,https://s.alicdn.com/@sc04/kf/H0a142eaae37f43a7a5757bdc117978ec2.png_720x720q50.jpg,https://s.alicdn.com/@sc04/kf/Hb688feaf9836491facc2baba8b2ed7bbO.png_720x720q50.jpg,https://s.alicdn.com/@sc04/kf/H457f23c9671b4ec7b06395c038ae36d1V.png_720x720q50.jpg,Merkloos,8410900587198,4-8d
BOL2-MJ-K0297-250618-17,BOL2-MJ-K0297-250618-17,Rood lichttherapiemasker - 7-kleuren LED-gezichtsmasker voor reis- en thuisgebruik,"<p>PROFESSIONELE VERJONGING - Met geavanceerde LED-roodlichttechnologie bereikt u een diepe huidverbetering, wat de weg vrijmaakt voor een thuisspa-ervaring en huidproblemen oplost.</p>
<p>OPLAADBARE BATTERIJ - Onge?venaarde energie-effici?ntie en batterijduur zorgen voor eenvoudige huidverzorging in het dagelijks leven of op reis met het Red Light gezichtsmasker, voorzien van een ingebouwde oplaadbare batterij met grote capaciteit die    lang meegaat.</p>
<p>SLIMME DIMMING VOOR VERBETERDE VERZORGING - Met meerdere geavanceerde intensiteitsinstellingen en intelligente dimfunctie biedt dit roodlichtmasker een milde verzorging voor uw huid. Laat ons masker uw teint verwennen en voeden met een geweldig proces.</p>
<p>VEILIG EN COMFORTABEL: Ervaar een gezichtsbehandeling zoals voorheen met ons roodlichtmasker. De nauwkeurig ontworpen gezichtscontour zorgt voor een comfortabele en veilige pasvorm en laat uw huid stralen dankzij de huidvriendelijke materialen.</p>
<p>GEMAKKELIJK TE DRAGEN Ons Red Light gezichtsmasker is uitgerust met een ultralichte body en een handige, draagbare tas, waardoor het gemakkelijk in uw tas of koffer past. Neem uw huidverzorgingsroutine overal mee naartoe.</p>",34.77 ,100 ,https://cbu01.alicdn.com/img/ibank/O1CN018y8og722nABtxcoiA_!!2210109417164-0-cib.jpg,https://m.media-amazon.com/images/I/71ZQwvHahEL._SL1500_.jpg,https://m.media-amazon.com/images/I/717Lzfx7w6L._SL1500_.jpg,https://m.media-amazon.com/images/I/71KjnyQ9xxL._SL1500_.jpg,https://m.media-amazon.com/images/I/61DNvQG8OZL._SL1392_.jpg,Merkloos,8410900587204,4-8d
BOL2-MJ-K0297-250618-18,BOL2-MJ-K0297-250618-18,"Airbrush-set Airbrush-set met airbrushcompressor Nagelcharms Draadloze airbrush voor kapper, nail art, taartdecoratie, make-up, modelschilderen (zwart)","<p>¡¾Sterkere druk en betere luchtstroom¡¿De structuur van onze airbrush-set is niet gemakkelijk te blokkeren en de spray is krachtig en delicaat. Vergeleken met de gewone luchtdruk op de markt, hebben we twee soorten echte luchtdruk om uit te kiezen, waardoor
u twee luchtdrukopties (30 psi, 35 psi) over uw kunstwerk kunt gebruiken.</p>
<p>¡¾Breed inzetbaar¡¿Onze airbrush-set kan in verschillende werkomgevingen worden gebruikt, zoals in combinatie met cosmetica voor huidverzorging, artistieke tatoeages, spraypainting, nagelverbetering, taartdecoratie, enzovoort.</p>
<p>¡¾Grotere batterijcapaciteit en handig opladen¡¿Vergeleken met gewone batterijen gebruiken we batterijen die duurder zijn en een grotere capaciteit hebben, waardoor uw werkuren aanzienlijk kunnen worden verlengd en ze duurzamer en langer meegaan. Ons airbrushpistool
is uitgerust met een USB-oplaadkabel, wat opladen gemakkelijk maakt.&nbsp;</p>
<p>¡¾3 bekers met verschillende capaciteit¡¿Voor verschillende gebruiksscenario's hebben we drie bekerformaten (7 cc, 20 cc, 40 cc) met verschillende capaciteiten geconfigureerd.</p>
<p>¡¾0,25 mm vloeistofsproeikop¡¿We gebruiken fijne spuitpistoolaccessoires om zeer moeilijk werk te kunnen uitvoeren en tegelijkertijd zoveel mogelijk grondstoffen te besparen tijdens het gebruik.</p>",47.99 ,100 ,https://cbu01.alicdn.com/img/ibank/O1CN01oXeN7i1v5ve8hjPfo_!!2215604496122-0-cib.jpg,https://m.media-amazon.com/images/I/71b3+SKarQL._SL1500_.jpg,https://m.media-amazon.com/images/I/71qiv11K0yL._SL1500_.jpg,https://m.media-amazon.com/images/I/813qDC-6aTL._SL1500_.jpg,https://m.media-amazon.com/images/I/71Ymz0D402L._SL1500_.jpg,Merkloos,8410900587211,4-8d
BOL2-MJ-K0297-250618-19,BOL2-MJ-K0297-250618-19,"L-E-D Light 7-kleuren SPA-gezichtslicht, multifunctioneel schoonheidsapparaat voor thuissalons voor vrouwen Multi-color LED-gezichtsmasker, draagbaar roodlichttherapiemasker, huidverzorging voor thuis en op reis","<p>¡¾LED-gezichtsmasker met lichttherapie¡¿Dit lichttherapiemasker heeft vele kleuren die overeenkomen met verschillende lichtmodi. Het LED-lichttherapiemasker is een draagbaar LED-lichttherapieapparaat voor thuisgebruik dat kan helpen bij het oplossen van    diverse huidproblemen.</p>
<p>¡¾Schoonheid en veiligheid¡¿Combineer verschillende lampen naar wens voor meerdere gezondheids- en schoonheidsvoordelen. Het is extreem duurzaam, waardoor het veilig, natuurlijk en herbruikbaar is. Een must voor overwerk en laat opblijven om stress te verlichten.</p>
<p>¡¾Eenvoudig en gebruiksvriendelijk¡¿U kunt thuis genieten van professionele huidverzorging, vergelijkbaar met schoonheidssalons. Vrije combinatie van verschillende lampen. Het is zeer duurzaam, veilig, natuurlijk en herbruikbaar.</p>
<p>¡¾Productsamenstelling¡¿Het LED-lichttherapiemasker is een draagbaar LED-lichttherapieapparaat voor thuisgebruik dat kan helpen bij het oplossen van diverse huidproblemen. Het LED-lichttherapiemasker bestaat uit een masker, controller, adapter, USB-kabel    en bandjes.</p>",76.76 ,100 ,https://cbu01.alicdn.com/img/ibank/O1CN01w5BslY2CrsblHRMGz_!!2215633598528-0-cib.jpg,https://m.media-amazon.com/images/I/71tsDb09r3L._AC_SL1500_.jpg,https://m.media-amazon.com/images/I/61vF4LC+r2L._AC_SL1500_.jpg,https://m.media-amazon.com/images/I/71Y7qyPEegL._AC_SL1500_.jpg,https://m.media-amazon.com/images/I/71-R9MmFipL._AC_SL1500_.jpg,Merkloos,8410900587228,4-8d
BOL2-MJ-K0297-250618-20,BOL2-MJ-K0297-250618-20,"Gezichtsverzorgingsproduct absorbeert Derma Pen-apparaat, LED-lichttherapie gezichtsmassager, thermische en ijskoelende roller","<p>Nieuw ontworpen 4-in-1 gezichtsapparaat: verbeterde huidverzorgingsproducten absorberen; 5 ledlampjes; ijskoeling en thermische massage.</p>
<p>3 vervangende cartridges, veilige en gebruiksvriendelijke kop, effectievere absorptie, keuze uit 9 vibratiesnelheden.</p>
<p>5 kleuren ledlampjes, gericht op verschillende huidverzorgingsbehoeften.</p>
<p>IJskoelingskussen kan je huid kalmeren, pori?n sluiten, wallen verminderen, een perfecte aanvulling op je huidverzorgingsroutine.</p>
<p>Thermische massager kan je huid activeren, zodat voedingsstoffen volledig worden opgenomen.</p>",39.46 ,100 ,https://m.media-amazon.com/images/I/61VAEzFlfsL._AC_SL1500_.jpg,https://m.media-amazon.com/images/I/71Li3bbzaHL._AC_SL1500_.jpg,https://m.media-amazon.com/images/I/81F-zMYY3QL._AC_SL1500_.jpg,https://m.media-amazon.com/images/I/81vC7dJFXQL._AC_SL1500_.jpg,https://m.media-amazon.com/images/I/71A9d2MrnAL._AC_SL1500_.jpg,Merkloos,8410900587235,4-8d
BOL2-MJ-K0297-250618-21,BOL2-MJ-K0297-250618-21,Rode lichttherapie voor het gezicht 7 kleuren LED-gezichtslichtroller gezichtsmassager cadeau voor vrouwen thuis huidverzorging (zwart),"<p>Lichttherapie voor het gezicht: Het lichttherapieapparaat voor het gezicht combineert de kracht van led-, warmte- en vibratietechnologie. Elke technologie speelt in op verschillende gebruikersvoorkeuren en -behoeften.</p>
<p>Multifunctioneel beauty-instrument: Het apparaat voor gezichtsverzorging maakt gebruik van 7 verschillende ledlichtstanden en 3 massagestanden om de huid te stimuleren en zo fijne lijntjes en rimpels te verminderen. Perfect voor het masseren van gezicht
en hals.</p>
<p>Gezichts- en halsmassage: Dit compacte en draagbare gezichtsmassageapparaat maakt lichaamsverzorging thuis of onderweg mogelijk. Met ¨¦¨¦n druk op de knop kunt u wisselen tussen standen en lichtkleuren voor een comfortabele huidverzorgingservaring. Krijg
altijd en overal een gladde, jeugdige huid.</p>
<p>Draagbaar formaat: Dit gezichtsmassageapparaat biedt professionele gezichts- en halsverzorging, waar u ook bent. Dankzij het intu?tieve ontwerp kunt u de stand en lichtkleur eenvoudig aanpassen met twee knoppen, wat zorgt voor een naadloze en comfortabele
huidverzorgingservaring.</p>",33.34 ,100 ,https://m.media-amazon.com/images/I/61lWzXLuXML._AC_SL1500_.jpg,https://m.media-amazon.com/images/I/713mPpXyXaL._AC_SL1500_.jpg,https://m.media-amazon.com/images/I/71teuYPMWnL._AC_SL1500_.jpg,https://m.media-amazon.com/images/I/71Fu6ti6lkL._AC_SL1500_.jpg,https://m.media-amazon.com/images/I/61Tp0vwRuWL._AC_SL1500_.jpg,Merkloos,8410900587242,4-8d
BOL2-MJ-K0297-250618-22,BOL2-MJ-K0297-250618-22,"Mee-eters verwijderen met vacu¨¹mzuiger, hydrodermabrasie-apparaat, vacu¨¹mzuigapparaat voor pori?n met 6 zuigkoppen, 3 versnellingen, USB-oplaadbaar watercircuit, hulpmiddel voor het verwijderen van puistjes","<p>Geavanceerde dieptereiniging met hydraterende bubbels: De mee-eterverwijderaar combineert technologie met kleine bubbels en vacu¨¹mabsorptie om je pori?n diep te reinigen en je huid gehydrateerd te houden. Dit innovatieve systeem met dubbele werking verwijdert
effectief mee-eters, whiteheads en overtollige olie en helpt zelfs fijne lijntjes te vervagen, waardoor je huid er fris en verjongd uitziet. Ideaal voor wie op zoek is naar een grondige maar milde gezichtsreiniging.</p>
<p>Aanpasbaar voor alle huidtypen: Met 3 instelbare zuigkrachtniveaus is de mee-eterverwijderaar geschikt voor droge, vette en neutrale huidtypen. Of je nu een gevoelige huid hebt of een intensievere reiniging nodig hebt, met dit apparaat kun je de zuigkracht
aanpassen aan je specifieke behoeften, waardoor je keer op keer een veilige en effectieve behandeling krijgt.</p>
<p>6 verwisselbare zuigkoppen voor veelzijdige verzorging: De mee-eterverwijderaar wordt geleverd met 6 verwisselbare zuigkoppen, elk ontworpen voor verschillende huidproblemen. Van het aanpakken van hardnekkige mee-eters tot het zachtjes exfoli?ren van
gevoelige plekken, deze opzetstukken bieden een complete huidverzorgingsoplossing die zich aanpast aan jouw unieke behoeften.</p>
<p>Hygi?nisch ontwerp met onafhankelijke vloeistoftank: Met een onafhankelijke vloeistoftank en scheiding van vuil water zorgt de mee-eter-pori?n-verwijderaar ervoor dat de reinigingsvloeistof niet wordt gerecirculeerd, waardoor huidinfecties worden voorkomen
en een optimale hygi?ne wordt behouden. Dit doordachte ontwerp maakt het een veilige en betrouwbare keuze voor dagelijkse huidverzorgingsroutines.</p>
<p>Draagbaar en oplaadbaar voor gebruik onderweg: De mee-eter-verwijderaar is ontworpen voor gebruiksgemak en heeft een ingebouwde oplaadbare batterij die tot 120 minuten continu gebruik ondersteunt. Het compacte en lichtgewicht ontwerp maakt het gemakkelijk
mee te nemen, zodat je je huidverzorgingsroutine kunt blijven volgen, of je nu thuis bent of op reis.</p>",24.75 ,100 ,https://m.media-amazon.com/images/I/61dyxLd-L-L._AC_SL1500_.jpg,https://m.media-amazon.com/images/I/71Pi+Bq5JvL._AC_SL1500_.jpg,https://m.media-amazon.com/images/I/71IBVW2S-iL._AC_SL1500_.jpg,https://s.alicdn.com/@sc04/kf/Hebbfa395a418445eac0cafb3da1447c74.jpg_720x720q50.jpg,https://s.alicdn.com/@sc04/kf/Hd511c19e5f3445c2ad025a7c10cdca33A.jpg_720x720q50.jpg,Merkloos,8410900587259,4-8d
BOL2-MJ-K0297-250618-23,BOL2-MJ-K0297-250618-23,"Elektrische ultrasone huidscrubber, gezichtsscrubber, gezichtsscrubber en spatel voor diepe reiniging, mee-eterverwijderaar, pori?nreiniger, schoonheidsinstrument met 3 standen","<p>?Diepe reiniging van de huid met behulp van ultrasone en nanotechnologie, met 28.000 trillingen per seconde om snel en grondig mee-eters, acne, dode huidcellen en make-upresten te verwijderen. Laat je huid er scherper en gladder uitzien.</p>
<p>?Diepe reiniging, hoge frequentie trillingen kunnen tot ongeveer 3-5 mm diep in je huid doordringen en reinigen de pori?n effectief. Bevordert de bloedsomloop en het metabolisme van je huid; elimineert rimpels, lift en verstevigt je gezicht.</p>
<p>?Werkt beter samen met huidverzorgingsproducten zoals dieptereinigingsolie, reinigingsschuim, toner, etherische olie, essence cr¨¨me, enz. Geschikt voor thuisgebruik, schoonheidssalons en op reis. De beste keuze voor het reinigen en verzorgen van je huid.</p>
<p>?Veilig en gemakkelijk te gebruiken, huidverzorging kan thuis worden gedaan zonder dat je naar een schoonheidssalon hoeft. Volg gewoon de instructies van de ultrasone huidscrub om het huidverzorgingsproces te voltooien. Bespaar veel tijd en geld.</p>
<p>?Waarschuwing: Gebruik geen huidverzorgingsproducten tijdens het opladen. Mensen met een gevoelige huid moeten het aantal reinigingsbeurten per week beperken en de reinigingstijd per keer niet langer dan 3 minuten laten duren.</p>",27.22 ,100 ,https://cbu01.alicdn.com/img/ibank/O1CN018etySm1NUwGpo4taq_!!2215466351574-0-cib.jpg,https://m.media-amazon.com/images/I/61u+sWZWyCL._AC_SL1001_.jpg,https://m.media-amazon.com/images/I/41VKOlNYN9L._AC_SL1001_.jpg,https://m.media-amazon.com/images/I/61t6WwAKavL._AC_SL1001_.jpg,https://m.media-amazon.com/images/I/51hyOxDQ4zL._AC_SL1001_.jpg,Merkloos,8410900587266,4-8d
